,Tweet_Id,User_Id,User_Name,User_Screen_Name,Theme,Text
502,1255126664276783104,82151473,Ask Citi,AskCiti,Bank/Financial,@VardgesL Please let us know your account type and country opened to ensure the right team helps. Do not include account numbers or PINs. ^Jody https://t.co/gvC4jAOA9c
503,1255126258209390592,82151473,Ask Citi,AskCiti,Bank/Financial,@trishanax3 Hi there. We'd be happy to help. Please DM us your account type and country it was opened in. No account numbers or PIN in your reply. ^Ana https://t.co/gvC4jAOA9c
504,1255125792788545536,82151473,Ask Citi,AskCiti,Bank/Financial,"@enerjoyce Hello Joyce! Thank you for contacting us. I am sorry to hear we were not able to assist you with your dispute. Please DM us with the details as to the reason for your claim denial. Also, what type of account was your purchase made with?  No account numbers or PINs. Thanks! ^John https://t.co/gvC4jAOA9c"
505,1255125577801007105,82151473,Ask Citi,AskCiti,Bank/Financial,"@Dahjur Find the latest updates on the Paycheck Protection Program and other helpful information for small business owners with the link posted below: 

https://t.co/MJb453OtHo

^Moe"
506,1255123458587009025,82151473,Ask Citi,AskCiti,Bank/Financial,"@anands4u22 Hello. For assistance with Citi India accounts, fill out the contact form through this link https://t.co/jzdhB2ZCmT and the next available agent will respond. ^Gloria"
507,1255122924920541186,82151473,Ask Citi,AskCiti,Bank/Financial,"@jrfuisz I'm sorry to hear this. For PPP program, information supplied is matched with that of your local government, Citi and SBA requirements. To review this further, please DM the branch name and address you were expecting a call from. Do not include any PIN or account numbers. ^Deanna https://t.co/gvC4jAOA9c"
508,1255120608138010627,82151473,Ask Citi,AskCiti,Bank/Financial,"@kfeelan Hello Kevin, Thanks for contacting Citi. So we may better assist, please confirm your account type and the country related to your concern. (Do Not include any personal account numbers or PIN's). ^Warren"
509,1255120580136914948,82151473,Ask Citi,AskCiti,Bank/Financial,"@REALLY78487735 I hate to hear this is the experience. Your deposits are evaluated at the time that they are made and based on your relationship with the bank, some or all of that deposit may be made available to you immediately. I hope this helps. ^Jody"
510,1255120013406752768,82151473,Ask Citi,AskCiti,Bank/Financial,@jfclinton2008 Hello. I'm sorry to hear this. I'd like to help address your concerns. Please DM us your account type and country it was opened in. No account numbers or PIN in your reply. ^Ana https://t.co/gvC4jAOA9c
511,1255114734959034370,82151473,Ask Citi,AskCiti,Bank/Financial,"@Gb908 We'd like to look into your case. Please DM us the account type, and country it was opened in. No account numbers and no PIN in your DM. ^Moe https://t.co/gvC4jAOA9c"
512,1255114027983831040,82151473,Ask Citi,AskCiti,Bank/Financial,@adil0516 Hello Mohammed. Thanks for your message. Can you send us a DM with the location your account was opened in only? ^Tania https://t.co/gvC4jAOA9c
513,1255111175391625219,82151473,Ask Citi,AskCiti,Bank/Financial,@x_Th3_Truth_x Hello Jeremy. That is not the service we strive to deliver. I'd like to hear more details of what occurred. Feel free to send us a DM. No need to include any account number or PIN information. We look forward to hearing back from you. ^Tania https://t.co/gvC4jAOA9c
514,1255110499760570368,82151473,Ask Citi,AskCiti,Bank/Financial,"@LLprodcasting You would need to contact our Citi Business team for assistance. You may call 1-877-528-0990 TDD/TTY: 1-800-788-0002. Please keep in mind that due to the COVID-19, you may experience longer than usual wait times. ^Ana"
515,1255108263248527370,82151473,Ask Citi,AskCiti,Bank/Financial,@OGrealneal Saw your DM. We refer you to our DM sent. ^Deanna https://t.co/gvC4jAOA9c
516,1254944959297400833,82151473,Ask Citi,AskCiti,Bank/Financial,"@EricN19007998 Hello Eric, and thank you for reaching out. My apologies for the delay in our response. We'd like to help any way we can. Send us a DM with your credit card type and the country where it was opened. For security, do not include any account numbers or PINs. Thanks again! ^Cynthia https://t.co/gvC4jAOA9c"
517,1254944393250947074,82151473,Ask Citi,AskCiti,Bank/Financial,"@DNG225 Hello Daniel, and thank you for reaching out. My apologies for the delays you've been experiencing. We'd like to help. Send a DM with your account type, the country where it was opened and a few details regarding your concerns. Do not include any account numbers or PINs. ^Cynthia https://t.co/gvC4jAOA9c"
518,1254944055626211328,82151473,Ask Citi,AskCiti,Bank/Financial,"@LLprodcasting Hi Lisa, this account is not eligible for mobile deposits. ^Tea"
519,1254943842954027013,82151473,Ask Citi,AskCiti,Bank/Financial,"@swissmendel I'm sorry to hear you're having trouble reaching someone. Due to the current situation, the hold time is longer than usual. Please try calling again at a later time. Thanks. ^Johnny https://t.co/gvC4jAOA9c"
520,1254943730915827717,82151473,Ask Citi,AskCiti,Bank/Financial,@amj663 We haven't heard back from you. Please let us know if you require further assistance. ^Shaun https://t.co/gvC4jAOA9c
521,1254943626196652034,82151473,Ask Citi,AskCiti,Bank/Financial,"@Zsavooz Hello DG, I'm sorry to hear this. Thank you for taking the time to provide this valuable feedback. We'd like to forward this information to the appropriate business team. Send a DM with the card type you have &amp; the country where it was opened. No account numbers or PINs. ^Cynthia https://t.co/gvC4jAOA9c"
522,1254942689843429377,82151473,Ask Citi,AskCiti,Bank/Financial,"@worldlyroamer Hello, we apologize for the delayed reply due to the COVID-19 situation. Were you able to get your concern addressed? ^Johnny"
523,1254940627286048778,82151473,Ask Citi,AskCiti,Bank/Financial,@jeniacono Hi there follow us when you get a chance. ^Tea https://t.co/gvC4jAOA9c
524,1254938155431743489,82151473,Ask Citi,AskCiti,Bank/Financial,"@swissmendel Thank you for reaching out. We're sorry for any difficulties you had experienced with the online application. If you'd prefer to speak to representative with the application department please call 888-201-4523. Their hours are Mon-Fri, 7 am to 7 pm CST. I hope this helps. ^Mike"
525,1254937103412142080,82151473,Ask Citi,AskCiti,Bank/Financial,"@ag3982 Hello Alex, and thank you for your message. I'm sorry to hear that you feel this way. We'd like to help any way we can. Send us a DM with your account type, the country where it was opened and a few details. For security, do not include account numbers or PINs. ^Cynthia https://t.co/gvC4jAOA9c"
526,1254936369002151938,82151473,Ask Citi,AskCiti,Bank/Financial,"@veithernet Hello Eric, and thank you for reaching out. My apologies for the delay in our response. We'd like to help. Send us a DM with your credit card type, the country where it was opened and a few details. For security, do not include account numbers or PINs. Thanks again! ^Cynthia https://t.co/gvC4jAOA9c"
527,1254934065083568128,82151473,Ask Citi,AskCiti,Bank/Financial,"@kashdasavage Hello, we apologize for the delayed reply due to the COVID-19 situation. Were you able to get your concern addressed? ^Johnny https://t.co/gvC4jAOA9c"
528,1254927681193459713,82151473,Ask Citi,AskCiti,Bank/Financial,"@littlepineapplo I'm sorry to hear this. To better assist, can you DM us additional details of the issue, your account type, and the country where it was opened (no account numbers or PINs)? I look forward to hearing back from you. ^Johnny https://t.co/gvC4jAOA9c"
529,1254926597930582016,82151473,Ask Citi,AskCiti,Bank/Financial,"@bonniecaye Hi there, I wanted to check back in and make sure there was nothing else we can do to help. Feel free to reach back out if you need assistance. ^Johnny https://t.co/gvC4jAOA9c"
530,1254924236168232960,82151473,Ask Citi,AskCiti,Bank/Financial,"@JamesGormley7 If help is still needed please follow us, so we may respond to your DM. ^Tea https://t.co/gvC4jAOA9c"
531,1254921508302061569,82151473,Ask Citi,AskCiti,Bank/Financial,"@WenyanB Hi there, I wanted to check back in and make sure there was nothing else we can do to help. Feel free to reach back out if you need assistance. ^Johnny https://t.co/gvC4jAOA9c"
532,1254921069925892097,82151473,Ask Citi,AskCiti,Bank/Financial,"@littlepineapplo Hello, we apologize for the delayed reply due to the COVID-19 situation. Were you able to get your concern addressed? ^Johnny"
533,1254916960086827009,82151473,Ask Citi,AskCiti,Bank/Financial,"@ChiChiMTG Hello Chirayu, and thank you for reaching out. My apologies for the delay in our response. We'd like to help. Send us a DM with your account type and the country where it was opened. For security, do not include account numbers or PINs. Thanks again! ^Cynthia https://t.co/gvC4jAOA9c"
534,1254902984388931584,82151473,Ask Citi,AskCiti,Bank/Financial,"@Tom_Lisi Hi Tom, thank you for contacting us. We are happy to look into this. Please DM a copy of the email and the address where it was received. ^Shaun https://t.co/gvC4jB6b0K"
535,1254894362955259905,82151473,Ask Citi,AskCiti,Bank/Financial,"@SHCh17373339 Hello, we apologize for the delayed reply due to the COVID-19 situation. Were you able to get your concern addressed? If not, please give us a quick follow, so we may reply to your DM. Thanks. ^Johnny https://t.co/gvC4jAOA9c"
536,1254887079101808650,82151473,Ask Citi,AskCiti,Bank/Financial,"@JulieMcDermot11 Hi there, you can still DM us  more details when you get a chance. ^Tea https://t.co/gvC4jAOA9c"
537,1254882976560754688,82151473,Ask Citi,AskCiti,Bank/Financial,"@VickTandon Citi continues to be dedicated to serving our small business clients. Please follow us so we may DM the following:
https://t.co/OSyTwwcZz0 name and/or owner name
https://t.co/Y2rn4SQgRg address
iii.Application ID (if applicable/available)
^Tea https://t.co/gvC4jAOA9c"
538,1254882527250128901,82151473,Ask Citi,AskCiti,Bank/Financial,"@michaeljason75 Hello, we apologize for the delayed reply due to the COVID-19 situation. Were you able to get your concern addressed? ^Johnny https://t.co/gvC4jAOA9c"
539,1254881203078991872,82151473,Ask Citi,AskCiti,Bank/Financial,"@DavVallejo Hi David, I'm sorry to hear this. Please DM us if you still need assistance. I believe you've also reached out on Facebook. Let us know which method you'd prefer for communication. Thanks. ^Johnny https://t.co/gvC4jAOA9c"
540,1254880635539394563,82151473,Ask Citi,AskCiti,Bank/Financial,"@uxallday Hello, I apologize for the late response due to COVID-19 impact causing higher than normal call volume worldwide. Have you received assistance? If not, please DM to confirm your account type, country and details of your concern. Do not include account numbers or PINs. ^Jocelyn"
541,1254877735006191617,82151473,Ask Citi,AskCiti,Bank/Financial,"@JBrickett87 Hi Jocelyn, this isn't the experience we wanted you to have. To better assist, can you DM us your account type and the country where it was opened (no account numbers or PINs)? I look forward to hearing back from you. ^Johnny https://t.co/gvC4jAOA9c"
542,1254870741557956611,82151473,Ask Citi,AskCiti,Bank/Financial,"@arlyzmarie Hello, thank you for reaching out. Please follow the link below for updates and information on our Payment Protection Program availability. ^Johnny
https://t.co/MJb453OtHo https://t.co/gvC4jAOA9c"
543,1254870443800039424,82151473,Ask Citi,AskCiti,Bank/Financial,"@AsilMcNeil Hello, I apologize for the late response due to COVID-19 impact causing higher than normal call volume worldwide. Have you received assistance? If not, please DM to confirm your account type, country and details of your concern. Do not include account numbers or PINs. ^Jocelyn https://t.co/gvC4jAOA9c"
544,1254861927450161153,82151473,Ask Citi,AskCiti,Bank/Financial,"@capeclarissa Hello, I apologize for the late response due to COVID-19 impact causing higher than normal call volume worldwide. Have you received assistance? If not, please DM to confirm your account type, country and details of your concern. Do not include account numbers or PINs. ^Jocelyn https://t.co/gvC4jB6b0K"
545,1254861364918657029,82151473,Ask Citi,AskCiti,Bank/Financial,"@ReneeDurante Thank you for your response. To better assist with filing this complaint, please send us a DM with your account type and country opened. For your security, do not include any account numbers or PINs. ^Jocelyn https://t.co/gvC4jAOA9c"
546,1254853264530702346,82151473,Ask Citi,AskCiti,Bank/Financial,"@HGlorioso1996 Not all new accounts get temporary account numbers, I'm sorry. If its available, you can get it from that team only. ^Mike"
547,1254851191969890306,82151473,Ask Citi,AskCiti,Bank/Financial,@HGlorioso1996 I understand. We have had to close call centers worldwide due to the pandemic. It may take several calls to reach a live agent. I am sorry that this has caused you such a delay. ^Mike
548,1254850478317268997,82151473,Ask Citi,AskCiti,Bank/Financial,"@LadySnipes_xox Lady Snipes, thank you for reaching out. I cannot access your account through this channel. I’d like to help. Send a DM with the following your account type and the country it was opened. Never include any account numbers or PINs. ^Mike"
549,1254848390183215105,82151473,Ask Citi,AskCiti,Bank/Financial,"@HiJonRamirez Hello, thank you for reaching out. To better assist, can you DM us additional details of the issue, your account type, and the country where it was opened (no account numbers or PINs)? I look forward to hearing back from you. ^Johnny https://t.co/gvC4jAOA9c"
550,1254848228203388928,82151473,Ask Citi,AskCiti,Bank/Financial,"@KayHaywood2 Kay, thank you for reaching out. I cannot access your account through this channel. I’d like to help. Send a DM with the following your account type and the country it was opened. Never include any account numbers or PINs. ^Mike"
551,1254847962947125248,82151473,Ask Citi,AskCiti,Bank/Financial,"@Judge_Weaver Hello, this isn't the experience we wanted you to have. To better assist, can you DM us additional details of the issue, your account type, and the country where it was opened (no account numbers or PINs)? I look forward to hearing back from you. ^Johnny https://t.co/gvC4jAOA9c"
552,1254842702971252739,82151473,Ask Citi,AskCiti,Bank/Financial,"@TalesOfTiredMom Thank you for your response. To better assist, please send us a DM with your account type and country opened. As a reminder, do not include any account numbers or PINs. ^Jocelyn https://t.co/gvC4jAOA9c"
553,1254841956410314755,82151473,Ask Citi,AskCiti,Bank/Financial,@theMrBirkelund Hi! We haven't heard back from you. Let us know if you still need help. ^Tania https://t.co/gvC4jAOA9c
554,1254841101657288704,82151473,Ask Citi,AskCiti,Bank/Financial,@sethgdc Please provide us with details regarding your concern. Please do not include any account numbers or PINs. Sincerely ^Fred
555,1254835884995817478,82151473,Ask Citi,AskCiti,Bank/Financial,"@JoseJrq777 Hi Jose, thank you for reaching out. To better assist, can you DM us additional details of the issue, your account type, and the country where it was opened (no account numbers or PINs)? I look forward to hearing back from you. ^Johnny https://t.co/gvC4jAOA9c"
556,1254832775401811968,82151473,Ask Citi,AskCiti,Bank/Financial,"@AlexNSanDiego Hi Alexander, we'd like to help. Please DM a copy of the email you received. We'd like to submit a request to get this corrected. ^Shaun https://t.co/gvC4jAOA9c"
557,1254832669449490438,82151473,Ask Citi,AskCiti,Bank/Financial,"@WidowMaker187 Deplorable, I am sorry you're having this experience. Type BESTBUY dot ACCOUNTONLINE dot COM into an alternate browser or in incognito mode. Let me know if this helps. ^Mike"
558,1254832317220171776,82151473,Ask Citi,AskCiti,Bank/Financial,"@s_escher Hi Sarah, we regret the difficulties you are experiencing. Please DM details of the issue. For your security don't include account numbers or PINs. ^Shaun https://t.co/gvC4jAOA9c"
559,1254830837360623616,82151473,Ask Citi,AskCiti,Bank/Financial,"@ReneeDurante I'm sorry to hear this, Renee. If you'd like us to capture your formal complaint, please DM us additional details of the issue, your card type, and the country where it was opened (no account numbers or PINs). Thanks. ^Johnny https://t.co/gvC4jAOA9c"
560,1254830110517182466,82151473,Ask Citi,AskCiti,Bank/Financial,"@adventuresofjon Hello Jon. Thank you for sharing the details of your experience. Can you DM us and provide your credit card product type i.e. Double Cash, ThankYou, Best Buy etc? We ask that you do not include any account number or PIN information. ^Tania https://t.co/gvC4jAOA9c"
561,1254826241976348673,82151473,Ask Citi,AskCiti,Bank/Financial,@swapips007 Thank you for reaching out. You can reach Citi India https://t.co/W7g6iN7ahv  directly here for immediate service. I know they can assist you with this matter and would be happy to find a resolution. Have a wonderful day. ^Mike
562,1254826056135163906,82151473,Ask Citi,AskCiti,Bank/Financial,"@MeimeiGlamz Hello, our site is up and running. Please try typing CITI dot COM into a new browser or use incognito mode.  Avoid using any links or bookmarks. If you still experience the same issue contact our 24 hour online technicians at 800-374-9700 (debit) or 800-950-5114 (credit). ^Mike"
563,1254824373317484550,82151473,Ask Citi,AskCiti,Bank/Financial,@BhavikKanabar Thank you for reaching out. You can reach Citi India https://t.co/W7g6iN7ahv  directly here for immediate service. I know they can assist you with this matter and would be happy to find a resolution. Have a wonderful day. ^Mike
564,1254823882021916672,82151473,Ask Citi,AskCiti,Bank/Financial,Protect your CARES Act payments: Validate emails or text messages are legitimate before you take any action requested to receive your money.  Please visit the Citi Security Center for more details on how to protect yourself. https://t.co/K0viliT9DI https://t.co/JdPOSQHdCc
565,1254822513210785793,82151473,Ask Citi,AskCiti,Bank/Financial,@barnes_niya Thanks for reaching out. We have sent you a DM. ^Moe
566,1254820223787700224,82151473,Ask Citi,AskCiti,Bank/Financial,@YinYangCab Hi there! Thanks for reaching out. I'd like to look into this further. Please DM the card or account type related and the country where it was opened. Don't include account numbers or PINs. ^Shaun https://t.co/gvC4jAOA9c
567,1254819431311687681,82151473,Ask Citi,AskCiti,Bank/Financial,"@DeanRegy_ Sounds good, please provide us with a good phone number to reach you. It can take up to 72 hours for someone from our Social Media team to become available. Sincerely ^Fred"
568,1254817536618770438,82151473,Ask Citi,AskCiti,Bank/Financial,"@nikkip50220357 Hello. Thank you for contacting us. We'd like to address your concerns. Can you provide your credit card product type i.e. Double Cash, ThankYou, Best Buy etc? Please do not include any account number or PIN information. ^Tania https://t.co/gvC4jAOA9c"
569,1254812721838686213,82151473,Ask Citi,AskCiti,Bank/Financial,"@AjayVas65245128 Ajay, thank you for reaching out. I cannot access your account through this channel. I’d like to help. Send a DM with the following your account type and the country it was opened. Never include any account numbers or PINs. ^Mike"
570,1254812149416898561,82151473,Ask Citi,AskCiti,Bank/Financial,@DeanRegy_ We understand the frustration. We would be happy to collect your feedback over the phone regarding this matter. Please let us know if you would like to provide us with your feedback. Sincerely ^Fred
571,1254811755043323909,82151473,Ask Citi,AskCiti,Bank/Financial,"@MorganteTanika Hello Tanika. I'm sorry to hear this happened. For further assistance, send us a DM with your account type and location only. Thank you for your time. ^Tania https://t.co/gvC4jAOA9c"
572,1254811416588058625,82151473,Ask Citi,AskCiti,Bank/Financial,"@arizaLsolano Thank you for reaching out. You can reach Citi Philippines directly here 
https://t.co/9B8ZMDYQiN  for immediate service. I know they can assist you with this matter and would be happy to find a resolution. Have a wonderful day. ^Mike"
573,1254810525319475202,82151473,Ask Citi,AskCiti,Bank/Financial,"@JarrydRazak I'm sorry to hear you that impression of us. We'd like to see what we can do to assist. Feel free to DM us your account type, location and the details of your inquiry. Please do not include any account number or PIN information. Looking forward to hearing back from you. ^Tania https://t.co/gvC4jAOA9c"
574,1254808746687180803,82151473,Ask Citi,AskCiti,Bank/Financial,"@Meetsavla Meetudi, I am sorry to hear this. Please use this link https://t.co/jzdhB2ZCmT to contact our partners in India to discuss this further. ^Shaun https://t.co/gvC4jAOA9c"
575,1254807472407293955,82151473,Ask Citi,AskCiti,Bank/Financial,"@DeanRegy_ Hi, we are sorry to hear the frustration. When an account is closed by Citibank we provide you with a letter that gives you more information on why the account was closed. Sincerely ^Fred"
576,1254806967425601536,82151473,Ask Citi,AskCiti,Bank/Financial,"@barnes_niya Hi, we do not have anyone at the moment. You have the option of reaching out to our New Account Servicing team directly at :
 
New Account Servicing
800-745-1534 

 TDD and TTY 
800-945-0258 

If you prefer we will reach out when someone is available.  Please let us know. ^Fred"
577,1254806594489126914,82151473,Ask Citi,AskCiti,Bank/Financial,"@Cherner Hello David. We are not able to DM you back. Feel free to follow @AskCiti, so we can reply to your message. ^Tania https://t.co/gvC4jAOA9c"
578,1254804345012604929,82151473,Ask Citi,AskCiti,Bank/Financial,@MJKrok Hello Matthew. Thank you for contacting us. Can you DM us to let us know what browser you are using? ^Tania https://t.co/gvC4jAOA9c
579,1254801992603533312,82151473,Ask Citi,AskCiti,Bank/Financial,"@akosibelmc Hi there! Thank you for contacting us. For more information, please log in to your account to Chat with an agent or to send a Secure Message. ^Shaun https://t.co/gvC4jAOA9c"
580,1254800942605754369,82151473,Ask Citi,AskCiti,Bank/Financial,"@SasiUgarteTeves Hi Sasi,, we are sorry to hear this. Please DM the card or account type you need help with along with the country where it was opened. Don't include account numbers or PINs. ^Shaun https://t.co/gvC4jAOA9c"
581,1254799401744314370,82151473,Ask Citi,AskCiti,Bank/Financial,"@Anubhav28284 Thanks for contacting Citi. So we may better assist, please confirm your account type and the country related to your concern. (Do Not include any personal account numbers or PIN's). ^Warren"
582,1254799020213633026,82151473,Ask Citi,AskCiti,Bank/Financial,"@mistu801 -Hi Madhurima, thank you for contacting us. Please use this link https://t.co/jzdhB2ZCmT to contact our partners in India for further assistance. ^Shaun https://t.co/gvC4jAOA9c"
583,1254789008581746691,82151473,Ask Citi,AskCiti,Bank/Financial,"@majolly5  Thanks for contacting us, Magaly. I regret the issues you're experiencing and want to help. Can you provide any error messages received, your account type and country where it was opened (no account numbers or PINs)? I look forward to your reply. ^Jovit https://t.co/gvC4jB6b0K"
584,1254788372259692545,82151473,Ask Citi,AskCiti,Bank/Financial,"@1977FCPA Hi Marvin, for your privacy we ask that you delete any public message that contains personal details. We want to help. Can you DM us to confirm what type of account this is regarding, bank or credit card? Please do not reply with any account numbers or PINs. Thank you. ^Jovit https://t.co/gvC4jB6b0K"
585,1254786153397407744,82151473,Ask Citi,AskCiti,Bank/Financial,@mikegast Hello Mike! Thanks for reaching out. Can you provide your account type and location opened in only? ^Tania https://t.co/gvC4jB6b0K
586,1254779944506232834,82151473,Ask Citi,AskCiti,Bank/Financial,"@fpadillaIII I apologize for the late response due to COVID-19 impact causing higher than normal call volume worldwide. Have you received assistance? If not, please DM to confirm your account type, country and details of your concern. Do not include account numbers or PINs. ^Jocelyn https://t.co/gvC4jB6b0K"
587,1254775896658960385,82151473,Ask Citi,AskCiti,Bank/Financial,@JamesOrlando126 Hello James. I'm sorry to hear this happened. I'd be happy to have this matter addressed. Feel free to send us a DM with your account type and location only. Thanks! ^Tania https://t.co/gvC4jB6b0K
588,1254774132471783425,82151473,Ask Citi,AskCiti,Bank/Financial,@Rydsmith89 Hello Ryan. That certainly is not the experience we wanted you to have. Can you DM us your account type and location opened only? We're here to help. ^Tania https://t.co/gvC4jB6b0K
589,1254769635666169856,82151473,Ask Citi,AskCiti,Bank/Financial,"@crowd79 Hi Jeff! I'm following up on your inquiry. If you still need assistance, send us a DM. Thanks! ^Tania https://t.co/gvC4jB6b0K"
590,1254768035723960320,82151473,Ask Citi,AskCiti,Bank/Financial,"@doitwithadayjob Hello! We'd be glad to assist. Can you provide your account type i.e. checking, savings and the location the account was opened in only? We ask that you do not include any account number or PIN details. ^Tania https://t.co/gvC4jAOA9c"
591,1254765998965735424,82151473,Ask Citi,AskCiti,Bank/Financial,@GolfIron360 Hi! I'm following up on your inquiry. Send us a DM if help is still required. Thanks! ^Tania https://t.co/gvC4jAOA9c
592,1254762163601883136,82151473,Ask Citi,AskCiti,Bank/Financial,@MrB33310791 Just reaching out since no response found. Feel free to reach out should further assistance be needed of you have any questions. ^Deanna
