,Tweet_Id,User_Id,User_Name,User_Screen_Name,Theme,Text
1508,1250512611139035140,1178011,Wells Fargo,WellsFargo,Bank/Financial,"@bonfirenight115 If you’re banking online: Go to the person icon in the top bar and select message center. There you may choose your inquiry, the best way to reach you, and additional details. Thank you for your patience. - Anna"
1509,1250512568000688128,1178011,Wells Fargo,WellsFargo,Bank/Financial,"@bonfirenight115 Hi, we are sorry for the long hold times while we work hard to support our customers. We encourage you to remain on hold and in parallel send us an email via our online banking or mobile app."
1510,1250511266097106947,1178011,Wells Fargo,WellsFargo,Bank/Financial,"@Marsiiir Hi, the Government has created a tool to view the status of your individual payment. Please visit https://t.co/mXl9i4n6jU to view your status and latest updates. Thank you. - Anna"
1511,1250506264922198017,1178011,Wells Fargo,WellsFargo,Bank/Financial,"@MurrmorMeerkat Hi, the Government has created a tool to view the status of your individual payment. Please visit https://t.co/Av9SAjZ8bc to view your status and latest updates. Thank you. - Johanna"
1512,1250505152601128960,1178011,Wells Fargo,WellsFargo,Bank/Financial,"Many customers will receive stimulus payments automatically in their accounts. If you received a paper check, we recommend using our mobile app or an ATM to deposit. We are pleased to cash stimulus checks for non-customers, with no-fees charged. Learn more:"
1513,1250486407694606338,1178011,Wells Fargo,WellsFargo,Bank/Financial,"@Marissa60100202 Hi Marissa, the Government has created a tool to view the status of your individual payment. Please visit https://t.co/ZKbjZnZzKL to view your status and latest updates. Thank you. - Anna"
1514,1250485978579578881,1178011,Wells Fargo,WellsFargo,Bank/Financial,"@channelsxo Hi, the Government has created a tool to view the status of your individual payment. Please visit https://t.co/NRisrl7ppf to view your status and latest updates. Thank you. - Anna"
1515,1250467659600277504,1178011,Wells Fargo,WellsFargo,Bank/Financial,"@CovidCalm Our team is processing the extraordinary number of requests and applications we’ve received. While we cannot specify timing, we are working to provide customers with up-to-date information as soon as possible. Thank you for your continued patience. - Anna"
1516,1250429388933328898,1178011,Wells Fargo,WellsFargo,Bank/Financial,"@wearediamnds Hi!  You can find all the details of the program at this link: https://t.co/Yxsg1Jyftj

-EC"
1517,1250407519383687169,1178011,Wells Fargo,WellsFargo,Bank/Financial,"@dreaB2 I truly apologize for the frustration caused by this experience. If you would like us to look into this,  please send us a DM and tell us some more details about what's going on (no account numbers). -Britney"
1518,1250289526657806342,1178011,Wells Fargo,WellsFargo,Bank/Financial,@diptithreading Hi. Could you please send us a DM with the email that you used for the PPP application? We'd like to take a look at this for you. Thanks. --Rosa https://t.co/olzw5tX4tH
1519,1250289389080440835,1178011,Wells Fargo,WellsFargo,Bank/Financial,@jonatha57481648 Hi Jonathan. Could you please send us a DM with the email that you used for the PPP application? We'd like to take a look at this for you. Thanks. --Rosa https://t.co/olzw5tX4tH
1520,1250280922588393472,1178011,Wells Fargo,WellsFargo,Bank/Financial,@CurrySrCenter We're all in this together. We're glad to be able to support.  - Bryan
1521,1250274756856647681,1178011,Wells Fargo,WellsFargo,Bank/Financial,"@JayfultzBanks Hi Jay - according to the Government, the stimulus payments to eligible recipients are expected to begin in mid-April. Please visit https://t.co/q5KqFd3orN for the latest information and updates. Thank you. -- Bryan"
1522,1250266564395290625,1178011,Wells Fargo,WellsFargo,Bank/Financial,"@jolenekramer59 Hi. Our team is processing the extraordinary number of requests and applications we’ve received. While we cannot specify timing, we are working to provide customers with up-to-date information as soon as possible. Thank you for your continued patience. --Rosa"
1523,1250249335952027648,1178011,Wells Fargo,WellsFargo,Bank/Financial,"@Joseph73064557 Hi Joseph - Our process is to review your inputs for the application and let you know when its ready for submission to the SBA.  I hope that helps.  Thanks, Jen"
1524,1250248432943579137,1178011,Wells Fargo,WellsFargo,Bank/Financial,"@freaknroller Hi Mike. Our team is processing the extraordinary number of requests and applications we’ve received. While we cannot specify timing, we are working to provide customers with up-to-date information as soon as possible. Thank you for your continued patience. --Rosa"
1525,1250233404009971712,1178011,Wells Fargo,WellsFargo,Bank/Financial,"@keeeeeniiaaaa Due to high call volumes, we encourage you to remain on hold and in parallel send us an email via our online banking or mobile app. Let us know how we can help. Thank you  - Johanna"
1526,1250233049905876998,1178011,Wells Fargo,WellsFargo,Bank/Financial,"@keeeeeniiaaaa Hi Kenia. We are aware of the long waits, and we appreciate you being patient and understanding with us as all of our employees work their hardest to help you. We're helping everyone as quickly as we can. 1/2"
1527,1250232321946587137,1178011,Wells Fargo,WellsFargo,Bank/Financial,"@peaceofnadia Hi Nadia.  According to the government, payments to eligible recipients are expected to begin in mid-April. You may consider setting up a direct deposit alert through Wells Fargo Online®. Learn more. https://t.co/asQbXaSTt9. Let us know if you have any other question - Johanna"
1528,1250231945524588545,1178011,Wells Fargo,WellsFargo,Bank/Financial,"@geeksquadx Hello. According to the government, payments to eligible recipients are expected to begin in mid-April. You may consider setting up a direct deposit alert through Wells Fargo Online®. Learn more. https://t.co/FbV91GmLZh - Johanna"
1529,1250231226042122241,1178011,Wells Fargo,WellsFargo,Bank/Financial,"@Dope_Ass_Swiff Hello. According to the government, payments to eligible recipients are expected to begin in mid-April. You may consider setting up a direct deposit alert through Wells Fargo Online®. Learn more. https://t.co/gPIU4KOjY2 - Johanna"
1530,1250229722434469889,1178011,Wells Fargo,WellsFargo,Bank/Financial,"@randii_lyn Hi Randyi. According to the government, payments to eligible recipients are expected to begin in mid-April. You may consider setting up a direct deposit alert through Wells Fargo Online®. Learn more. https://t.co/MNatc3Enel - Johanna"
1531,1250229390610481155,1178011,Wells Fargo,WellsFargo,Bank/Financial,"@Cynthia39632370 Hi Cynthia. For those customers who received an email stating that you’re already in our queue, your place remains secured and you’ll receive a follow-up email with tips to help you prepare for the application process. Thank you for your patience. --Rosa"
1532,1250224080927756288,1178011,Wells Fargo,WellsFargo,Bank/Financial,"@Essrobeer Hi. For those customers who received an email stating that you’re already in our queue, your place remains secured and you’ll receive a follow-up email with tips to help you prepare for the application process. Thank you for your patience. --Rosa"
1533,1250219771288678402,1178011,Wells Fargo,WellsFargo,Bank/Financial,"Two of the CARES Act relief programs we are supporting include: the Paycheck Protection Program (PPP) providing loans to help small businesses, and the government stimulus payment delivering assistance checks to many Americans. Find answers about these efforts at:"
1534,1250179553231806465,1178011,Wells Fargo,WellsFargo,Bank/Financial,"@NaomiWagner Hi Naomi. You are right. We'll email you within the next few days, however I cannot advise a specific date. I'm so sorry for the inconveniences. - Johanna"
1535,1250177052269072387,1178011,Wells Fargo,WellsFargo,Bank/Financial,"@PSCC_Tualatin Thank you for your understanding, Jonathan. We are doing our best to support all our customers- Johanna"
1536,1250175720741130243,1178011,Wells Fargo,WellsFargo,Bank/Financial,"@PSCC_Tualatin Hi Jonathan. Unfortunately, we don't have an exact timeline for this. Please know we are working as quickly as possible to assist small business customers with the Paycheck Protection Program (PPP). - Johanna"
1537,1250175371313664012,1178011,Wells Fargo,WellsFargo,Bank/Financial,@Essrobeer Hi Ess. I'm sorry to hear you had a negative experience with us. Please let us know how we can help you. - Johanna
1538,1250173653150502914,1178011,Wells Fargo,WellsFargo,Bank/Financial,"@demaria_tina Hi Tina. I hear you and I'm so sorry for any inconveniences. Our team is processing the extraordinary number of  applications we’ve received. While we cannot specify timing, we are working to provide customers with up-to-date information as soon as possible.  Thank you Johanna"
1539,1250171231833411585,1178011,Wells Fargo,WellsFargo,Bank/Financial,"@chynnaken Hi Chynna. Federal guidelines dictate that “critical infrastructure sectors” have a “special responsibility” to keep running. Financial services is one of those sectors, highlighting just how important our work is for our communities  - Johanna"
1540,1250170583486287878,1178011,Wells Fargo,WellsFargo,Bank/Financial,"@www_healthecon Hi. I'm so sorry for any inconveniences. Our team is processing the extraordinary number of requests we’ve received. For those customers who received an email stating that you’re already in our queue, your place remains secured and you’ll receive a follow-up email. . - Johanna"
1541,1250165301465034758,1178011,Wells Fargo,WellsFargo,Bank/Financial,"@NaomiWagner Hi Naomi. I hear you and I'm so sorry for any inconveniences. Our team is processing the extraordinary number of requests and applications we’ve received. While we cannot specify timing, we are working to provide customers with up-to-date information as soon as possible.  - JLFT"
1542,1250164885574553601,1178011,Wells Fargo,WellsFargo,Bank/Financial,"@ADSDoorSD Hi. Unfortunately, we don't have an exact timeline for this. Please know we are working as quickly as possible to assist small business customers with the Paycheck Protection Program (PPP). - Johanna"
1543,1250163983325200384,1178011,Wells Fargo,WellsFargo,Bank/Financial,"@Joseph73064557 Hi Joseph. Thanks for reaching out. We are working as quickly as possible to assist small business customers with the Paycheck Protection Program (PPP). You are eligible if you have a Wells Fargo business checking account as of February 15, 2020. - Johanna"
1544,1250163155910774784,1178011,Wells Fargo,WellsFargo,Bank/Financial,"@curbedcomedy Hi. We are providing assistance including fee waivers, payment deferrals, and other expanded assistance for credit card, auto, home lending, small business and personal lending customers who contact us. Please email us through our secure online banking message center. - Johanna"
1545,1250162188444196864,1178011,Wells Fargo,WellsFargo,Bank/Financial,"@janssoneric Hi. We apologize for the inconvenience. If you have not received an email stating that you're already in our queue, we recommend you apply. We have restarted our submission of interest process via an intake form. Visit https://t.co/9GtOWbb2Dq. - Johanna"
1546,1250158294217392132,1178011,Wells Fargo,WellsFargo,Bank/Financial,"@vall_noemi Hi Noemi. According to the government, payments to eligible recipients are expected to begin in mid-April. You may consider setting up a direct deposit alert through Wells Fargo Online®. Learn more. https://t.co/rUXEXGefnH - Johanna"
1547,1250106022896848896,1178011,Wells Fargo,WellsFargo,Bank/Financial,"@essybabyyy : Hi, according to the Government the stimulus payments to eligible recipients are expected to begin in mid-April. We encourage you to set up account alerts. So you’ll know when you receive a direct deposit, like the stimulus payment. Learn more at https://t.co/MplEvv0e4K

-EC"
1548,1250103760401154048,1178011,Wells Fargo,WellsFargo,Bank/Financial,"@EfrainR93703273 Hi, according to the Government the stimulus payments to eligible recipients are expected to begin in mid-April. We encourage you to set up account alerts. So you’ll know when you receive a direct deposit, like the stimulus payment. Learn more at https://t.co/MplEvv0e4K -EC"
1549,1250103241079173120,1178011,Wells Fargo,WellsFargo,Bank/Financial,"@jpt602 Hi, each person’s eligibility is determined by the Government. To learn more about eligibility and payment amounts we encourage you to visit https://t.co/WPbKaoRFJB and also our FAQ page at https://t.co/SUW3tzbiKZ 

-EC"
1550,1250093787638124544,1178011,Wells Fargo,WellsFargo,Bank/Financial,"Or, if you did not file a tax return or have not given the IRS your direct deposit account information in the last two years, you’ll receive a paper, US Treasury check."
1551,1250093672760250371,1178011,Wells Fargo,WellsFargo,Bank/Financial,"You may receive it by automatic deposit into the bank account reflected or reported on your 2019 or 2018 tax return. This deposit will appear in your account summary as “tax refund,” “tax refund 2019,” or something similar."
1552,1250093311580426240,1178011,Wells Fargo,WellsFargo,Bank/Financial,"We understand the government stimulus payments are critically important to our customers. If you’re eligible to receive a payment, you may receive the funds in one of these ways:"
1553,1250092921715666946,1178011,Wells Fargo,WellsFargo,Bank/Financial,"@Alfonzzy_ Hi, according to the Government the stimulus payments to eligible recipients are expected to begin in mid-April. We encourage you to set up account alerts. So you’ll know when you receive a direct deposit, like the stimulus payment. Learn more at https://t.co/MplEvv0e4K  -EC"
1554,1250087907618144261,1178011,Wells Fargo,WellsFargo,Bank/Financial,@HarvestHopeFB Our pleasure!  Thank you for the opportunity to support this great cause! -EC
1555,1250086544305786880,1178011,Wells Fargo,WellsFargo,Bank/Financial,@GoodwillSP We are grateful for the opportunity to support this great cause. -EC
1556,1250085021140094978,1178011,Wells Fargo,WellsFargo,Bank/Financial,@nawboSA We are grateful for the opportunity. Thank you for having us! -EC
1557,1250084664229986305,1178011,Wells Fargo,WellsFargo,Bank/Financial,"@ComfyHVAC Abel, we understand your concern and frustration and please know that we are working through submissions as quickly as possible.  We appreciate your business and thank you for your patience. -EC"
1558,1250083165798096898,1178011,Wells Fargo,WellsFargo,Bank/Financial,"@1011NIGHTMARE Hello, I just ran across your tweet. Is there something specific that we can help with? If so, please send more information without sharing account numbers. Thank you. -Zora https://t.co/olzw5ueFSh"
1559,1249950641256050688,1178011,Wells Fargo,WellsFargo,Bank/Financial,@Atreides1243 Hi. The Federal Reserve has allowed us to expand lending to small businesses customers through PPP as of last Friday. We have restarted our submission of interest process via an intake form. Visit https://t.co/dYwcC3C1gh to submit your information.
1560,1249873204962877440,1178011,Wells Fargo,WellsFargo,Bank/Financial,"@MibShark Hi. According to the Government, the stimulus payments to eligible recipients are expected to begin in mid-April. Please visit https://t.co/cn26QDzD1v for the latest information and updates. Thank you. -Rosa"
1561,1249869114203652096,1178011,Wells Fargo,WellsFargo,Bank/Financial,@PxPULAR_CULTURE I noticed your mention. Were you able to access your online banking? Please let us know. -Bettina https://t.co/olzw5ueFSh
1562,1249846736279003138,1178011,Wells Fargo,WellsFargo,Bank/Financial,"@LilLovesRetail Hi Lilian. Our team is processing the extraordinary number of requests and applications we’ve received. While we cannot specify timing, we are working to provide customers with up-to-date information as soon as possible. Thank you for your continued patience."
1563,1249846337178349570,1178011,Wells Fargo,WellsFargo,Bank/Financial,"@maggycaruso Hi Maggy. Our team is processing the extraordinary number of requests and applications we’ve received. While we cannot specify timing, we are working to provide customers with up-to-date information as soon as possible. Thank you for your continued patience."
1564,1249822386796531713,1178011,Wells Fargo,WellsFargo,Bank/Financial,"@realrarora While we cannot specify timing, we are working to provide customers with up-to-date information as soon as possible. Thank you for your continued patience - Johanna"
1565,1249822343423287297,1178011,Wells Fargo,WellsFargo,Bank/Financial,@realrarora Hi Ray. I'm really sorry for the inconveniences. Our team is processing the extraordinary number of requests and applications we’ve received. 1/2
1566,1249785599478947842,1178011,Wells Fargo,WellsFargo,Bank/Financial,@corsey_joy Hi Joy! Each person’s eligibility is determined by the Government. To learn more about eligibility and payment amounts we encourage you to visit https://t.co/zisOFlFaD0 and also our FAQ page at https://t.co/spcWMUYu46
1567,1249772877890695168,1178011,Wells Fargo,WellsFargo,Bank/Financial,@UTCommAction We are grateful for the opportunity. Thank you for allowing us to support this great cause. -EC
1568,1249772365229314050,1178011,Wells Fargo,WellsFargo,Bank/Financial,We understand that you might have questions about the government stimulus payments. We’re here to help.
1569,1249699885902901248,1178011,Wells Fargo,WellsFargo,Bank/Financial,"@PathwaysVA Hi! You can find the links and information about applying on the page below. Hope this helps! -EC

https://t.co/O8xzdH57Vg"
1570,1249575332774109184,1178011,Wells Fargo,WellsFargo,Bank/Financial,"@signmysigns Hi. As stated in the email, you are currently in queue and your place remains secured. You’ll receive a follow-up email with tips to help you prepare for the application process. Thank you for your patience, and we apologize for the confusion."
1571,1249539730779377664,1178011,Wells Fargo,WellsFargo,Bank/Financial,"@RolloMike Hi Mike. Yes, we have begun to process applications and as it is a slow overall process, we thank you for your patience."
1572,1249520999919431682,1178011,Wells Fargo,WellsFargo,Bank/Financial,"@ocsmitty960 Thank you, Olivia! We truly are working hard to be there for our customers during this difficult time. Stay safe! --Rosa"
1573,1249505532748103681,1178011,Wells Fargo,WellsFargo,Bank/Financial,"@stephendisbrowe Have a great one, Stephen! Stay safe! --Rosa"
1574,1249455563513245697,1178011,Wells Fargo,WellsFargo,Bank/Financial,"@kaptainkremen Thanks David - We are aware of this issue and you need not worry as your login to secure session to complete the intake form would pull an exact match to your business name.  We apologize for the confusion.  Thanks, Jen"
1575,1249217313175371781,1178011,Wells Fargo,WellsFargo,Bank/Financial,"@johnathantyle10 Hi. We are working hard to process all intake forms ASAP. If you were able to submit yours, please expect an email from us soon with updates &amp; next steps on how to proceed with the application. Thank you for your patience."
1576,1249161361885724673,1178011,Wells Fargo,WellsFargo,Bank/Financial,"@4million4peace Thanks for sharing your concerns. Banks are a critical service provider as defined by federal, state &amp; local governments. Many employees are working from home. For those who can’t &amp; still serve customers, we’re taking steps to keep them safe: https://t.co/pvm0lbhSOe"
1577,1249142867051851778,1178011,Wells Fargo,WellsFargo,Bank/Financial,"@yummydevy If you’re banking online, go to the person icon in the top bar and select message center. There you may choose your inquiry, the best way to reach you, and additional details. Thank you for your patience."
1578,1249142837645623300,1178011,Wells Fargo,WellsFargo,Bank/Financial,"@yummydevy We are sorry for the long hold times while we work hard to support our customers. Due to high call and email volumes, we thank you for your effort to remain on hold and to also send us an email via our online banking or mobile app."
1579,1249127485259874304,1178011,Wells Fargo,WellsFargo,Bank/Financial,"@Oz_Bulls Hi. The PPP application process is strictly done online, which is why our branches have not been taking any applications in person. We are working as fast as we can to review all intake form submissions. Please expect an email from us soon with updates and next steps."
1580,1249126948892217345,1178011,Wells Fargo,WellsFargo,Bank/Financial,@l0llapall00za Hi. Please be assured that we are working as fast as we can to review all intake form submissions. Please expect an email from us soon with the next steps.
1581,1249125811489255424,1178011,Wells Fargo,WellsFargo,Bank/Financial,"@slim_sullivan Hi Slim. According to the Government, the stimulus payments to eligible recipients are expected to begin in mid-April. Please visit https://t.co/VrnuPcsOv2 for the latest information and updates. Thank you. --Rosa"
1582,1249122671067045889,1178011,Wells Fargo,WellsFargo,Bank/Financial,@jillchopkins Hi. Please let us know how we can help. Thanks. --Rosa
1583,1249122242606313473,1178011,Wells Fargo,WellsFargo,Bank/Financial,"@FairviewRestore Hi Blizzo. We are currently working hard to review all intake forms ASAP. If you've submitted an intake form, please expect an email from us soon with updates and next steps. Thank you for your patience."
1584,1249120615371546624,1178011,Wells Fargo,WellsFargo,Bank/Financial,@OrangeHandWash Hi there. Could you please send us a DM so we can assist? Thanks. --Rosa https://t.co/olzw5ueFSh
1585,1249116229740171264,1178011,Wells Fargo,WellsFargo,Bank/Financial,"@ShannonLvdP Hi Shannon. For those customers who received an email stating that you’re already in our queue, your place remains secured and you’ll receive a follow-up email with tips to help you prepare for the application process. Thank you for your patience."
1586,1249052952830119936,1178011,Wells Fargo,WellsFargo,Bank/Financial,"@MannyLuera3 Hello, Manny. Allow us to take a closer look at this and I'll try my best to help. Please DM us more details of the situation, your full name, phone number, and address (no account numbers or card numbers). Thanks. -Bettina https://t.co/olzw5ueFSh"
1587,1248945442198622208,1178011,Wells Fargo,WellsFargo,Bank/Financial,"@10_more_mins Hi Erin. For those customers who received an email stating that you’re already in our queue, your place remains secured and you’ll receive a follow-up email with tips to help you prepare for the application process. Thank you for your patience. - Nate"
1588,1248944394901901312,1178011,Wells Fargo,WellsFargo,Bank/Financial,"@Joseph73064557 Hi Joseph. We apologize for how you're feeling, but please know we are doing our best to review all submissions ASAP and support our customers during this difficult time. - Nate"
1589,1248943552819847169,1178011,Wells Fargo,WellsFargo,Bank/Financial,"@cloe__jade Hi Cloe. For those customers who received an email stating that you’re already in our queue, your place remains secured and you’ll receive a follow-up email with tips to help you prepare for the application process. Thank you for your patience. - Nate"
1590,1248933176845709313,1178011,Wells Fargo,WellsFargo,Bank/Financial,"@CHACHI5370 Hi. For those customers who received an email stating that you’re already in our queue, your place remains secured and you’ll receive a follow-up email with tips to help you prepare for the application process. Thank you for your patience. - Nate"
1591,1248843733753266176,1178011,Wells Fargo,WellsFargo,Bank/Financial,"@fake_teej Hi TJ. After the 90-day qualification period, we will deposit the $400 bonus into your new checking account within 30 days if you have met all offer requirements. Your account must remain open with a balance greater than $0 in order to receive the bonus."
1592,1248838422862729216,1178011,Wells Fargo,WellsFargo,Bank/Financial,"@johnnyusofa Hi Johnny. For those customers who received an email stating that you’re already in our queue, your place remains secured and you’ll receive a follow-up email with tips to help you prepare for the application process. Thank you for your patience."
1593,1248837665258078208,1178011,Wells Fargo,WellsFargo,Bank/Financial,"@Jblanco3870 Hi Jose. Yes, you must have a Wells Fargo business checking account as of February 15, 2020. Please visit https://t.co/7g1UCsVSLL for more information on the eligiblity."
1594,1248790894863581184,1178011,Wells Fargo,WellsFargo,Bank/Financial,"@GovDirections We're sorry for the frustration this has caused you, Mark. Did you receive an email stating that you are currently in queue? If so, your place remains secured &amp; you’ll receive a follow-up email with tips to help you prepare for the application process. Thanks for your patience."
1595,1248790395200430080,1178011,Wells Fargo,WellsFargo,Bank/Financial,"@drpatfarrell Hi Patricia. We implemented enhanced cleaning procedures in all our facilities following CDC or local public health guidance, &amp; increased shipments of hand sanitizer wipes and other supplies. Here's how we keep our team members safe: https://t.co/r4iKK2LZE6"
1596,1248788544887369728,1178011,Wells Fargo,WellsFargo,Bank/Financial,"@siehavas We apologize for how you're feeling, but please know we are doing our best to review all applications ASAP and support our customers during this difficult time."
