,Tweet_Id,User_Id,User_Name,User_Screen_Name,Theme,Text
0,1253775721073442816,80374332,Citibank,Citibank,Bank/Financial,Did you know you can get alerts on things like transactions so you can track spending on your account? Watch the video to learn how to set up account alerts in the Citi Mobile® App. https://t.co/1MKnhf44yZ
1,1253738036489224196,80374332,Citibank,Citibank,Bank/Financial,"We want to say “thank you” to all the front-line workers risking their lives to save others. Even if we’re apart, we’ll get through this together. #Gratitude https://t.co/fS79IMsBCD"
2,1253375593271394312,80374332,Citibank,Citibank,Bank/Financial,Registering for online access and activating your Citi® card is easy in the Citi Mobile® App. Learn more in the video below. https://t.co/Ec1rIUVX0l
3,1253322747851296768,80374332,Citibank,Citibank,Bank/Financial,"Protect your CARES Act payments: Validate communications are legitimate before clicking links, opening attachments, or providing personal or financial information.  Please visit the Citi Security Center for more details on how to protect yourself. https://t.co/r9RDJTJT8B https://t.co/wKdSqWi4p0"
4,1253066045700681731,80374332,Citibank,Citibank,Bank/Financial,It’s simple to set up a payment account in the Citi Mobile® App. Watch this video to learn how. https://t.co/CmodyQF6aG
5,1252960358454767616,80374332,Citibank,Citibank,Bank/Financial,"We’re committed to helping provide the support and solutions our customers need during #COVID19 and so we have launched further relief measures, including credit card payment deferrals and additional fee waivers. https://t.co/gG0UrKC0dk"
6,1252673469852143618,80374332,Citibank,Citibank,Bank/Financial,"Protect Yourself from COVID-19 Scams: Don’t release financial or personal information without confirming reports of relatives seeking medical treatment, or call the hospital or clinic directly to verify payment information. https://t.co/TJRpQwtrhz"
7,1252605509867384837,80374332,Citibank,Citibank,Bank/Financial,It’s easy to make a payment with the Citi Mobile® App. Watch this video for step-by-step instructions on how to do it. https://t.co/BPOHqdHyo3
8,1252356369153290240,80374332,Citibank,Citibank,Bank/Financial,Did you know you can set up a payment account in the Citi Mobile® App? Watch to learn more. https://t.co/CmodyQnuM6
9,1252311072079519744,80374332,Citibank,Citibank,Bank/Financial,"Citi has your banking needs covered so you can access your accounts from your favorite device, on the go. Download the Citi Mobile® App here: https://t.co/Z4juMTmeiC https://t.co/J5S5XmLCCg"
10,1251986429816852480,80374332,Citibank,Citibank,Bank/Financial,Did you know you can view up to 12 months of statements in the Citi Mobile® App? Learn how to go paperless in the video below. https://t.co/dgZgYHXQis
11,1251668546540703744,80374332,Citibank,Citibank,Bank/Financial,"RT @GlblCtzn: ⭕️We’re LIVE! Tune in to One World: #TogetherAtHome for performances from some of the world’s biggest artists, stories from f…"
12,1251661847255822338,80374332,Citibank,Citibank,Bank/Financial,To our heroes going out into the world each day – thank you. Citi is supporting COVID-19 relief efforts around the world to help those bravely showing up for the rest of us. https://t.co/oaknGpLLlX https://t.co/wRZ7o6lupM
13,1251616387254095875,80374332,Citibank,Citibank,Bank/Financial,"Even if we’re apart, we’ll get through this together. Tune in now for the digital livestream of One World #TogetherAtHome: https://t.co/oaknGpLLlX https://t.co/oN2p93SXjS"
14,1251613504584462336,80374332,Citibank,Citibank,Bank/Financial,"RT @GlblCtzn: We shall believe we can help one another get through this global health crisis #TogetherAtHome  🙏

Thank you @SherylCrow for…"
15,1251513855957766144,80374332,Citibank,Citibank,Bank/Financial,"Day after day, our heroes on the frontlines show up for us. Today we come #TogetherAtHome to honor them. Tune in for an event filled with your favorite entertainers to support COVID-19 relief efforts. Learn more @glblctzn: https://t.co/oaknGpLLlX https://t.co/UAOluhOSBv"
16,1251245296400637954,80374332,Citibank,Citibank,Bank/Financial,You can register for online access AND activate your Citi® card all within the Citi Mobile® App. Watch the video to learn how. https://t.co/Ec1rIUVX0l
17,1251148445928153089,80374332,Citibank,Citibank,Bank/Financial,"We’re committed to helping provide the support and solutions our customers need during #COVID19 and so we have launched further relief measures, including credit card payment deferrals and additional fee waivers. https://t.co/QfuKhHsSFo"
18,1250891727868702727,80374332,Citibank,Citibank,Bank/Financial,Protect Yourself from COVID-19 Scams: Be wary of contacts claiming to be hospital or clinic officials reporting that a relative has fallen sick from the virus and requesting payment for medical treatment. https://t.co/8bPBTHyk11
19,1250521211064520707,80374332,Citibank,Citibank,Bank/Financial,We've joined forces with @glblctzn for One World: #TogetheratHome. For more info on how to take action &amp; tune-in for your area visit: https://t.co/pWPYqAgAhx https://t.co/nGHWoTceJJ
20,1250098924146302976,80374332,Citibank,Citibank,Bank/Financial,"We’re committed to helping provide the support and solutions our customers need during #COVID19 and so we have launched further relief measures, including credit card payment deferrals and additional fee waivers. https://t.co/wAHyd1A2a7"
21,1250061248407965700,80374332,Citibank,Citibank,Bank/Financial,"Citi has your banking needs covered so you can access your accounts from your favorite device, on the go. Download the Citi Mobile® App here: https://t.co/Z4juMTmeiC https://t.co/J5S5XmLCCg"
22,1249781913172217869,80374332,Citibank,Citibank,Bank/Financial,"Protect Yourself from COVID-19 Scams: Don’t release financial or personal information without confirming reports of relatives seeking medical treatment, or call the hospital or clinic directly to verify payment information. https://t.co/vDnf5pRIOm"
23,1249751706847633410,80374332,Citibank,Citibank,Bank/Financial,Watch the video below to see how you can view your statements and more directly in the Citi Mobile® App. https://t.co/dgZgYHXQis
24,1249722812257927173,80374332,Citibank,Citibank,Bank/Financial,"We want to say “thank you” to all the front-line workers risking their lives to save others. Even if we’re apart, we’ll get through this together. #Gratitude https://t.co/jAyXfk60SA"
25,1249094881592500224,80374332,Citibank,Citibank,Bank/Financial,Healthcare workers on the frontline fighting the battle against COVID-19 need us now more than ever. We’re proud to team up with @glblctzn &amp; the @WHO to support One World: #TogetherAtHome - a special one-night event of music and advocacy on 4/18: https://t.co/pWPYqzYYSX https://t.co/45jlKqTNCd
26,1249011830544048130,80374332,Citibank,Citibank,Bank/Financial,Setting up account alerts in the Citi Mobile® App makes staying in the know about your account easy. Learn how to set them up by watching the video below. https://t.co/1MKnhf44yZ
27,1248693481536659458,80374332,Citibank,Citibank,Bank/Financial,Registering for online access and activating your Citi® card is easy in the Citi Mobile® App. Learn more in the video below. https://t.co/Ec1rIUVX0l
28,1248279507267727362,80374332,Citibank,Citibank,Bank/Financial,It’s simple to set up a payment account in the Citi Mobile® App. Watch this video to learn how. https://t.co/CmodyQF6aG
29,1248260858465091584,80374332,Citibank,Citibank,Bank/Financial,RT @AskCiti: Protect Yourself from COVID-19 Scams: Be wary of contacts claiming to be hospital or clinic officials reporting that a relativ…
30,1248260845790003200,80374332,Citibank,Citibank,Bank/Financial,RT @AskCiti: Protect Yourself from COVID-19 Scams: Don’t release financial or personal information without confirming reports of relatives…
31,1247903973240999941,80374332,Citibank,Citibank,Bank/Financial,"RT @Citi: The COVID-19 pandemic will have long-lasting and profound effects on the world, with structural changes to the global economy, in…"
32,1247886922199871491,80374332,Citibank,Citibank,Bank/Financial,It’s easy to make a payment with the Citi Mobile® App. Watch this video for step-by-step instructions on how to do it. https://t.co/BPOHqdZ9fB
33,1247570091023241216,80374332,Citibank,Citibank,Bank/Financial,"RT @Citi: Paralympian @BradSnyderUSA of #TeamCiti speaks with @UN_News_Centre about remaining active while staying indoors, managing self-i…"
34,1247551068202033154,80374332,Citibank,Citibank,Bank/Financial,"Citi has your banking needs covered so you can access your accounts from your favorite device, on the go. Download the Citi Mobile® App here: https://t.co/Z4juMTmeiC https://t.co/J5S5XmLCCg"
35,1247544070442037253,80374332,Citibank,Citibank,Bank/Financial,Healthcare workers on the frontline fighting the battle against COVID-19 need us now more than ever. We’re proud to team up with @glblctzn &amp; the @WHO to support One World: #TogetherAtHome - a special one-night event of music and advocacy on 4/18: https://t.co/EiqmUpGqYG https://t.co/IQgxmScLLg
36,1247543215240220673,80374332,Citibank,Citibank,Bank/Financial,Need assistance with your Citi account? Tweet @AskCiti – we’re here to help you with your questions! https://t.co/uJ8fEQ95cB
37,1245769071100145665,80374332,Citibank,Citibank,Bank/Financial,Don’t forget – we’re here to help if you need it. Tweet us (without personal info please) @AskCiti and we’ll get back to you shortly! https://t.co/3nPoY98tVD
38,1245044882672156674,80374332,Citibank,Citibank,Bank/Financial,Are you looking for Citi support? Send us a private message and we’ll get back to you. Please don’t include personal info in the comments of this post. https://t.co/9b0ZHsQlqp
39,1244625431959162885,80374332,Citibank,Citibank,Bank/Financial,Need a hand? Send us a private message and we’ll get back to you. PS: Please don't post personal account info within the comments of this post. https://t.co/4Dem7i7jNz
40,1244283175309840391,80374332,Citibank,Citibank,Bank/Financial,Need a hand? Send us a private message and we’ll get back to you. PS: Please don't post personal account info within the comments of this post. https://t.co/K1M9AXkrvY
41,1244006351296245760,80374332,Citibank,Citibank,Bank/Financial,Have a question about your Citi card? Get an answer by tweeting us (without personal info) @AskCiti! https://t.co/LCp9TOqvHg
42,1243962538083131392,80374332,Citibank,Citibank,Bank/Financial,@cgrand3 @nokidhungry 🙏 🙏 🙏 for all of your support of @nokidhungry!
43,1243962253814235139,80374332,Citibank,Citibank,Bank/Financial,"RT @cgrand3: Last week, my friends at @citibank pledged to match gifts to @nokidhungry up to $2M. Excited to share that in just 7 days, thi…"
44,1243945960222470144,80374332,Citibank,Citibank,Bank/Financial,You did it!  We have reached our $2 million match for @NoKidHungry! Together we’re making TWICE the impact on connecting hungry kids with the critical meals they need during this pandemic. https://t.co/zZZyrEfDeC
45,1243657001072242689,80374332,Citibank,Citibank,Bank/Financial,RT @nokidhungry: Our partner @Citibank pledged to match gifts up to $2 million. We’ve hit that goal faster than we could have dreamed! Than…
46,1243643972830015489,80374332,Citibank,Citibank,Bank/Financial,"We’ve got great news! In just 7 days, we’ve reached the $2 million match goal for @NoKidHungry.  That’s $4 million helping hungry kids from coast to coast during this crisis. Thank you to all who contributed! https://t.co/Z62NtWoiQB"
47,1243619804055056386,80374332,Citibank,Citibank,Bank/Financial,Need a hand? Send us a private message and we’ll get back to you. PS: Please don't post personal account info within the comments of this post. https://t.co/HojHY2ovBP
48,1243196515679698944,80374332,Citibank,Citibank,Bank/Financial,Have a question about your Citi account? Get an answer by private messaging us. PS: Please don't post personal account info within the comments of this post. https://t.co/5P8iXtALKa
49,1242879677313712129,80374332,Citibank,Citibank,Bank/Financial,Are you looking for Citi support? Send us a private message and we’ll get back to you. Please don’t include personal info in the comments of this post. https://t.co/3OII6zZgZw
50,1242613457951895552,80374332,Citibank,Citibank,Bank/Financial,"During this time, please note that for open branches, our branch hours in Local Time will be Monday – Friday 10am - 4pm and for some branches, Saturday 10am - 1pm. The ATMs located at branches will still be available 24/7. Stay updated at https://t.co/3D5Tki8gG8"
51,1242613456970399746,80374332,Citibank,Citibank,Bank/Financial,We’re taking necessary precautions to ensure that we do our part to help reduce the spread of COVID-19 while balancing the need to serve you.
52,1242560259128012803,80374332,Citibank,Citibank,Bank/Financial,"RT @nokidhungry: With your help, we’re able to provide support to schools and community groups working to feed kids during the #COVID19 out…"
53,1242466206541656064,80374332,Citibank,Citibank,Bank/Financial,Need a hand? Send us a private message and we’ll get back to you. PS: Please don't post personal account info within the comments of this post. https://t.co/ipO4GBYGa6
54,1242138146902618115,80374332,Citibank,Citibank,Bank/Financial,RT @nokidhungry: We’re working with schools and community groups to feed kids during the #COVID19 outbreak. Your donations continue to make…
55,1242115276348456960,80374332,Citibank,Citibank,Bank/Financial,RT @GlblCtzn: Stepping up the fight! Our partner @Citi Foundation is committing $15M to combat the effects of #covid19 &amp; support those in n…
56,1242088716782448640,80374332,Citibank,Citibank,Bank/Financial,Have a question about your account? Send us a private message and we’ll get back to you. PS: Please don't post personal account info within the comments of this post. https://t.co/xXxPagiyrq
57,1242079978986110976,80374332,Citibank,Citibank,Bank/Financial,RT @nokidhungry: We’re working to get schools and community groups emergency grants while our nation responds to #COVID19. Our partner @cit…
58,1241759049500237824,80374332,Citibank,Citibank,Bank/Financial,Millions of vulnerable children are losing the healthy meals they depend on as #covid19 closes schools nationwide. Donate now to @NoKidHungry and we will match gifts up to $2 million. Visit https://t.co/Esop3kbT0M https://t.co/8MR8JogTkj
59,1241384575466692615,80374332,Citibank,Citibank,Bank/Financial,Need a hand? Send us a private message and we’ll get back to you. PS: Please don't post personal account info within the comments of this post. https://t.co/cQD7osWdtz
60,1240697860812750850,80374332,Citibank,Citibank,Bank/Financial,Millions of vulnerable children are losing the healthy meals they depend on as #covid19 closes schools nationwide. Donate now to @NoKidHungry and we will match gifts up to $2 million. Visit https://t.co/Esop3kttSk https://t.co/KgzKSDlQiW
61,1240673670898626560,80374332,Citibank,Citibank,Bank/Financial,"RT @Citi: Today, #Citi Foundation announced a $15MM commitment to support #COVID19 related relief activities globally. This is a first step…"
62,1240296908503109632,80374332,Citibank,Citibank,Bank/Financial,Need a hand? Send us a private message and we’ll get back to you. PS: Please don't post personal account info within the comments of this post. https://t.co/cORQ5xXweA
63,1240292439539277825,80374332,Citibank,Citibank,Bank/Financial,"Visit https://t.co/IsWN1XtTDe to stay up-to-date with all the latest on account assistance, digital tools, and fee-free access to cash with Citibank debit cards at ATMs at key retailers &amp; Citi branches."
64,1239926981128597506,80374332,Citibank,Citibank,Bank/Financial,Have a question about your Citi card? Get an answer by tweeting us (without personal info) @AskCiti! https://t.co/NtTu23oY3Q
65,1239559546722553857,80374332,Citibank,Citibank,Bank/Financial,"We’re closely monitoring the latest reports from the CDC about the Coronavirus (COVID-19). For those who may have been impacted, visit https://t.co/HW11qp9JgQ or message @AskCiti to find out how we may be able to help."
66,1239551999731019776,80374332,Citibank,Citibank,Bank/Financial,Need a hand? Send us a private message and we’ll get back to you. PS: Please don't post personal account info within the comments of this post. https://t.co/1raaKBQTyj
67,1239250011109699584,80374332,Citibank,Citibank,Bank/Financial,Are you looking for Citi support? Send us a private message and we’ll get back to you. Please don’t include personal info in the comments of this post. https://t.co/om07s30x4d
68,1238518331063271424,80374332,Citibank,Citibank,Bank/Financial,"“All women are strong.” 💪 To celebrate #IWD2020, legendary fashion designer @DVF and Citi Global Consumer CMO Jennifer Breithaupt lead an inspiring conversation on taking charge and knowing your strength. #CitiInspires Watch the full 🎥 here: https://t.co/mtAkJGI5GG https://t.co/0KT2aq77XW"
69,1237860860380327938,80374332,Citibank,Citibank,Bank/Financial,🚨 Citi / AAdvantage Cardmembers 🚨 The #CitiPresale for @Enriqueiglesias &amp; @ricky_martin's #EnriqueRickyTour ends TODAY 10PM on 3/11. @AmericanAir https://t.co/DWmH0Y115M https://t.co/TPKWyOEjb2
70,1237820590691700737,80374332,Citibank,Citibank,Bank/Financial,#CitiPresale tickets are available for cardmembers to purchase NOW -3/12 @ 10pm to see @BrooksAndDunn on their Reboot 2020 Tour in a city near you! https://t.co/hv93qsud87 https://t.co/d17l1qQqSb
71,1237818074574860289,80374332,Citibank,Citibank,Bank/Financial,.@ChrisYoungMusic is taking his  Town Ain’t Big Enough World Tour to a city near you! Use your Citi card for #CitiPresale ticket access to select shows now! https://t.co/N08SNmeqVh https://t.co/SPp7prXJL4
72,1237815559342915587,80374332,Citibank,Citibank,Bank/Financial,"Cardmembers, you won’t want to miss this - tickets are available to purchase NOW through 3/12 @ 10pm to see @BradPaisley LIVE in a city near you! https://t.co/px5xtJgTkQ https://t.co/0MHw44Eu8h"
73,1237813041305194496,80374332,Citibank,Citibank,Bank/Financial,#CitiPresale tickets are available for cardmembers to purchase NOW -3/12 @ 10pm to see @theRATTpack on tour in a city near you! https://t.co/oV3GhIbp5p https://t.co/j6e4QA1B2N
74,1237810524961849344,80374332,Citibank,Citibank,Bank/Financial,".@LukeBryanOnline’s #ProudToBeRightHereTour is kicking off this summer w/support from @MorganWallen, @runawayjune, @CayleeHammack and cardmembers can purchase #CitiPresale tickets to new dates added NOW! https://t.co/bYOGPOG62c https://t.co/4dKdIRf85L"
75,1237808009679712256,80374332,Citibank,Citibank,Bank/Financial,.@MaksAndValTour are hitting the road on the Motion Pictures Tour w/ @PetaMurgatroyd &amp; @JennaJohnson! Cardmembers can purchase #CitiPresale tickets NOW! https://t.co/wbCbKftOOq https://t.co/YamHo3HLNn
76,1237805491922837504,80374332,Citibank,Citibank,Bank/Financial,Cardmembers – don’t miss out on seeing @JimmyEatWorld LIVE! #CitiPresale tickets are available NOW: https://t.co/fiWSKP5gPq https://t.co/NYTDz7pzii
77,1237802975273377802,80374332,Citibank,Citibank,Bank/Financial,.@LadyAntebellum’s Ocean 2020 Tour is kicking off in May &amp; #CitiPresale tickets are available NOW for cardmembers to purchase! https://t.co/MR4VqqclU6 https://t.co/bsJmWGqrNP
78,1237800462436511751,80374332,Citibank,Citibank,Bank/Financial,"Calling all pop culture and comic fans! Cardmembers now have access to a special ticket offer to @FloridaSupercon in Miami Beach, May 8-10! Purchase here: https://t.co/OUgVlQ1bB5 https://t.co/8lhHVGvT0N"
79,1237724965224493061,80374332,Citibank,Citibank,Bank/Financial,The @Enriqueiglesias &amp; @ricky_martin's #EnriqueRickyTour #CitiPresale for  Citi / AAdvantage Cardmembers ends TODAY at 10PM. Buy your 🎫 now! @AmericanAir https://t.co/DWmH0XJqee https://t.co/EQp7QM8F8n
80,1237478288316129285,80374332,Citibank,Citibank,Bank/Financial,RT @SebastianYatra: @enriqueiglesias  @ricky_martin ¿Estoy super emocionado de irme de gira con ustedes!🙏🔥 The #CitiPresale for the tour fo…
81,1237408472322490371,80374332,Citibank,Citibank,Bank/Financial,RT @ricky_martin: ¿Estas listo @enriqueiglesias? The #CitiPresale for our tour for Citi  / AAdvantage Cardmembers starts on 3/10 at 10 AM u…
82,1237402910855778304,80374332,Citibank,Citibank,Bank/Financial,.@FloridaSupercon is May 8-10 in Miami Beach &amp; cardmembers have the opportunity to purchase a Citi exclusive ticket package to this event NOW! https://t.co/OUgVlQ1bB5 https://t.co/DMLPo2KND8
83,1237377677243318272,80374332,Citibank,Citibank,Bank/Financial,Citi / AAdvantage Cardmembers IT'S TIME! @Enriqueiglesias &amp; @ricky_martin's #EnriqueRickyTour #CitiPresale is happening NOW until 10PM on 3/11. Buy your 🎫 now! @AmericanAir https://t.co/DWmH0XJqee https://t.co/A6FZ2awfKj
84,1237357067100467200,80374332,Citibank,Citibank,Bank/Financial,RT @enriqueiglesias: .@Ricky_Martin ¿estas listo? The #CitiPresale for Citi  / AAdvantage Cardmembers starts tomorrow at 10 AM. @AmericanAi…
85,1237112305810395136,80374332,Citibank,Citibank,Bank/Financial,"We’re closely monitoring the latest reports from the CDC about the Coronavirus (COVID-19). For those who may have been impacted, visit https://t.co/HW11qp9JgQ or message @AskCiti to find out how we may be able to help."
86,1237076690624557061,80374332,Citibank,Citibank,Bank/Financial,Are you looking for Citi support? Send us a private message and we’ll get back to you. Please don’t include personal info in the comments of this post. https://t.co/hwY83VMHsG
87,1237075877189562373,80374332,Citibank,Citibank,Bank/Financial,"“All women are strong.” 💪 To celebrate #IWD2020, legendary fashion designer @DVF and Citi Global Consumer CMO Jennifer Breithaupt lead an inspiring conversation on taking charge and knowing your strength. #CitiInspires Watch the full 🎥 here: https://t.co/mtAkJGI5GG https://t.co/fJXnJvto0q"
88,1237060624464728065,80374332,Citibank,Citibank,Bank/Financial,🚨 Citi / AAdvantage Cardmembers 🚨 @Enriqueiglesias &amp; @ricky_martin's #EnriqueRickyTour #CitiPresale is only from 3/10 at 10 AM until 10PM on 3/11. Set your ⏰ now! @AmericanAir https://t.co/ly3HtomNEe https://t.co/GTdutpwBNx
89,1237013406416359424,80374332,Citibank,Citibank,Bank/Financial,RT @paleycenter: #PaleyFestLA is mere days away! You could spend Mar 13-22 at @DolbyTheatre catching exclusive screenings and the casts of…
90,1236652957829074944,80374332,Citibank,Citibank,Bank/Financial,"Citi @TasteofTennis is a celebration that gathers some of sport’s elite players along with dozens of the brightest stars on the culinary circuit. Learn how Judi and Penny Lerner, a mother/daughter team and co-founders of @AYSWorld organized this event. https://t.co/r20Yz5jiju https://t.co/vwbOChVHDt"
91,1236462094314340353,80374332,Citibank,Citibank,Bank/Financial,"RT @CelebrityPageTV: .@Citibank and @CelebrityPageTV applaud the Grammy-winning, chart-topping, female voices creating the soundtrack for a…"
92,1236335808413663234,80374332,Citibank,Citibank,Bank/Financial,.@LadyGaga is hitting the road this summer with The Chromatica Ball. Citi cardmembers can register NOW for #CitiPresale access to these shows powered by #VerifiedFan. https://t.co/jIxSnEwPDt https://t.co/M0V4gTPOJ1
93,1236127951038681088,80374332,Citibank,Citibank,Bank/Financial,RT @CelebrityPageTV: .@Citibank and @CelebrityPageTV  celebrate the powerful voices singing the song of gender equality in media and music…
94,1236127924803244034,80374332,Citibank,Citibank,Bank/Financial,RT @CelebrityPageTV: .@Citibank and @CelebrityPageTV are proud supporters of #SeeHer #SeeHerHearHer advocating gender equality in media and…
95,1236064077652398082,80374332,Citibank,Citibank,Bank/Financial,Tennis and cooking: the two disciplines are more connected than you might think. And their common ground is on full display at Citi @TasteofTennis: https://t.co/r20Yz5jiju https://t.co/aWGhjMuVk5
96,1236047516162027520,80374332,Citibank,Citibank,Bank/Financial,"We’re closely monitoring the latest reports from the CDC about the Coronavirus (COVID-19). For those who may have been impacted, please DM @AskCiti to find out how we can help. https://t.co/goV0W8aObN"
97,1235994083593728000,80374332,Citibank,Citibank,Bank/Financial,".@LadyGaga’s #Chromatica Ball tour is kicking off in July &amp; Citi cardmembers can register for #VerifiedFan #CitiPresale ticket access NOW through Saturday, 3/7 at 11:59PM. https://t.co/jIxSnEwPDt https://t.co/dG6CUWVEDU"
98,1235969252777242625,80374332,Citibank,Citibank,Bank/Financial,"RT @TODAYshow: In honor of #InternationalWomensDay, “The More You Know” PSAs are getting a makeover! https://t.co/dWegrhjiF0"
99,1235969197425020933,80374332,Citibank,Citibank,Bank/Financial,RT @TODAYshow: We’re kicking off our #InternationalWomensDay celebration with the lovely ladies of Northeastern University’s all-female a c…
100,1235969157381922817,80374332,Citibank,Citibank,Bank/Financial,"RT @TODAYshow: ""Surround yourself with people that will cheer you on."" We’re talking to some very inspiring women from various professions…"
101,1235633683215904768,80374332,Citibank,Citibank,Bank/Financial,"🚨 Citi / AAdvantage Cardmembers 🚨 Latin Pop Icons,  @Enriqueiglesias &amp; @ricky_martin announce their first ever co-headlining tour.  Get #EnriqueRickyTour 🎟 with our #CitiPresale on 3/10 at 10 AM until 10PM on 3/11. @AmericanAir https://t.co/ly3HtomNEe https://t.co/NVCl5vKX6k"
